{
  "schema": "ai-chat-archive/conversation/1.0.0",
  "identity": {
    "conversation_key": "aaaaaaaaaaaaaaaaaaaaaaaaaaaaaaaaaaaaaaaaaaaaaaaaaaaaaaaaaaaaaaaa",
    "archive_id": "23a77298-5362-4aeb-ac85-0954a1bce36d"
  },
  "generation": {
    "parser_version": "0.6.0",
    "parser_adapter": {
      "id": "chatgpt-light-items-v2",
      "version": "1.3.0"
    },
    "exporter_version": "3.7.23-light"
  },
  "lifecycle": {
    "first_parsed_at": {
      "value": "2026-08-25T12:00:00.000Z",
      "basis": "parser_creation"
    },
    "last_parsed_at": "2026-08-25T12:00:00.000Z",
    "cloudig_edited_at": "2026-08-25T12:00:00.000Z"
  },
  "source": {
    "file": {
      "name": "conversation.html",
      "sha256": "bbbbbbbbbbbbbbbbbbbbbbbbbbbbbbbbbbbbbbbbbbbbbbbbbbbbbbbbbbbbbbbb",
      "size_bytes": 2048
    },
    "url": "https://chatgpt.com/c/example",
    "captured_at": {
      "value": "2026-08-25T11:58:00.000Z",
      "basis": "bookmark_metadata",
      "field": "manifest.exported_at"
    }
  },
  "message_time": {
    "start": "2026-08-25T10:00:00.000Z",
    "end": "2026-08-25T10:00:05.000Z",
    "timestamped_messages": 2,
    "total_messages": 2
  },
  "content_time": {
    "parser_default": {
      "edited_at": "2026-08-25T12:00:00.000Z",
      "derivation": "message_start",
      "range": {
        "start": {
          "kind": "terran_exact",
          "era": "AD",
          "year": 2026,
          "month": 8,
          "day": 25,
          "hour": 10,
          "minute": 0,
          "second": 0,
          "utc_offset": "Z"
        },
        "is_collapsed": true,
        "is_reversed": false
      }
    },
    "effective": {
      "source": "parser"
    }
  },
  "title": "V1 会话合同示例",
  "provider": "openai",
  "platform": "chatgpt",
  "models": [
    "GPT-5.6-Sol"
  ],
  "messages": [
    {
      "id": "msg_000001_user",
      "turn_id": "turn_000001_user",
      "role": "user",
      "timestamp": "2026-08-25T10:00:00.000Z",
      "content": [
        {
          "type": "markdown",
          "text": "请保留这段消息。"
        }
      ]
    },
    {
      "id": "msg_000002_assistant",
      "parent_id": "msg_000001_user",
      "turn_id": "turn_000002_assistant",
      "role": "assistant",
      "model": "GPT-5.6-Sol",
      "timestamp": "2026-08-25T10:00:05.000Z",
      "content": [
        {
          "type": "markdown",
          "text": "已保留。"
        }
      ]
    }
  ]
}
